{
  "schema_version": "oxford-published-index-item-collection-v1",
  "collection_id": "COLL-CROSS_REFERENCES-A64E2A638292",
  "item_kind": "cross_references",
  "source_artifact": {"artifact_path": "candidate/v7-migration/item-assessments.v7.json", "schema_version": "subject-index-item-assessments-v4", "sha256": "1629c0e1ae85ffe77d828e614235ba6935535248ff6bdf28c82e54732aaad74a"},
  "ordering": {"defect_derived_arrays": "ITEM-PROJECTION-DEFECT-ID-ASC-V1", "record_order": "authoritative_source_array_order", "rhetorical_reordering": false},
  "count": 16,
  "items": [
    {"confidence":"high","detail":{"judgment":"supported","record_id":"REC-FED6DE75256A","reference_type":"see also","source_node_id":"NODE-69A63372E6D1","source_path_id":"PATH-F64B81DE4926","target_display":"Leo X; Pius VI; Pius VII","target_path_id":null},"evidence_ids":["XREF-0ACD2D5DAC9E","PATH-F64B81DE4926","NODE-69A63372E6D1","NODE-D56A45CCAA72","NODE-4C895FD00FE8","NODE-1EEF29E93670"],"factors":[{"applied_cap":null,"evidence_ids":["XREF-0ACD2D5DAC9E","PATH-F64B81DE4926","NODE-69A63372E6D1","NODE-D56A45CCAA72","NODE-4C895FD00FE8","NODE-1EEF29E93670"],"explanation":"The source and target are distinct indexed concepts, and the resolvable target materially extends navigation.","factor_id":"cross_reference_validity","label":"Cross-reference validity","score":100.0,"severity_caps":[],"status":"supported"}],"grade":{"band":"excellent","color_token":"grade_excellent","rating":5.0,"score":100.0,"status":"passes"},"grade_scope":"one_cross_reference_relationship","item_id":"XREF-0ACD2D5DAC9E","item_kind":"cross_reference","label":"see also Leo X; Pius VI; Pius VII","navigation":{"source_node_id":"NODE-69A63372E6D1","source_path_id":"PATH-F64B81DE4926","target_path_id":null},"source_order":0,"summary":"The source and target are distinct indexed concepts, and the resolvable target materially extends navigation."},
    {"confidence":"high","detail":{"judgment":"supported","record_id":"REC-5FE75D1058FF","reference_type":"see also","source_node_id":"NODE-D80C8E906E9E","source_path_id":"PATH-147BB61B440F","target_display":"Dutch Republic","target_path_id":"PATH-E5BB43AFD121"},"evidence_ids":["XREF-112DBAA74C15","PATH-147BB61B440F","NODE-D80C8E906E9E","NODE-160DBF2B298E"],"factors":[{"applied_cap":null,"evidence_ids":["XREF-112DBAA74C15","PATH-147BB61B440F","NODE-D80C8E906E9E","NODE-160DBF2B298E"],"explanation":"The source and target are distinct indexed concepts, and the resolvable target materially extends navigation.","factor_id":"cross_reference_validity","label":"Cross-reference validity","score":100.0,"severity_caps":[],"status":"supported"}],"grade":{"band":"excellent","color_token":"grade_excellent","rating":5.0,"score":100.0,"status":"passes"},"grade_scope":"one_cross_reference_relationship","item_id":"XREF-112DBAA74C15","item_kind":"cross_reference","label":"see also Dutch Republic","navigation":{"source_node_id":"NODE-D80C8E906E9E","source_path_id":"PATH-147BB61B440F","target_path_id":"PATH-E5BB43AFD121"},"source_order":1,"summary":"The source and target are distinct indexed concepts, and the resolvable target materially extends navigation."},
    {"confidence":"high","detail":{"judgment":"supported","record_id":"REC-B828CBB73D91","reference_type":"see","source_node_id":"NODE-C35EDBB91019","source_path_id":"PATH-66CFD58C4980","target_display":"Orléans, Louis Philippe Joseph, Duke d' (1747-93)","target_path_id":"PATH-DED3EDE9926B"},"evidence_ids":["XREF-257ADA69D14E","PATH-66CFD58C4980","NODE-C35EDBB91019","NODE-FD29DEBEDD8E"],"factors":[{"applied_cap":null,"evidence_ids":["XREF-257ADA69D14E","PATH-66CFD58C4980","NODE-C35EDBB91019","NODE-FD29DEBEDD8E"],"explanation":"The source is a plausible alternate name or inversion, carries no locators, and resolves to a substantive target entry.","factor_id":"cross_reference_validity","label":"Cross-reference validity","score":100.0,"severity_caps":[],"status":"supported"}],"grade":{"band":"excellent","color_token":"grade_excellent","rating":5.0,"score":100.0,"status":"passes"},"grade_scope":"one_cross_reference_relationship","item_id":"XREF-257ADA69D14E","item_kind":"cross_reference","label":"see Orléans, Louis Philippe Joseph, Duke d' (1747-93)","navigation":{"source_node_id":"NODE-C35EDBB91019","source_path_id":"PATH-66CFD58C4980","target_path_id":"PATH-DED3EDE9926B"},"source_order":2,"summary":"The source is a plausible alternate name or inversion, carries no locators, and resolves to a substantive target entry."},
    {"confidence":"high","detail":{"judgment":"supported","record_id":"REC-3556E18DEB11","reference_type":"see also","source_node_id":"NODE-488818546241","source_path_id":"PATH-2ABBDFB53A36","target_display":"peasants","target_path_id":"PATH-E974D8CEB13D"},"evidence_ids":["XREF-341E6EF27F31","PATH-2ABBDFB53A36","NODE-488818546241","NODE-F73CD065C43A"],"factors":[{"applied_cap":null,"evidence_ids":["XREF-341E6EF27F31","PATH-2ABBDFB53A36","NODE-488818546241","NODE-F73CD065C43A"],"explanation":"The source and target are distinct indexed concepts, and the resolvable target materially extends navigation.","factor_id":"cross_reference_validity","label":"Cross-reference validity","score":100.0,"severity_caps":[],"status":"supported"}],"grade":{"band":"excellent","color_token":"grade_excellent","rating":5.0,"score":100.0,"status":"passes"},"grade_scope":"one_cross_reference_relationship","item_id":"XREF-341E6EF27F31","item_kind":"cross_reference","label":"see also peasants","navigation":{"source_node_id":"NODE-488818546241","source_path_id":"PATH-2ABBDFB53A36","target_path_id":"PATH-E974D8CEB13D"},"source_order":3,"summary":"The source and target are distinct indexed concepts, and the resolvable target materially extends navigation."},
    {"confidence":"high","detail":{"judgment":"supported","record_id":"REC-3503E2BC7FEE","reference_type":"see also","source_node_id":"NODE-6580CFCA31B7","source_path_id":"PATH-2BFCFED9D789","target_display":"assignats","target_path_id":null},"evidence_ids":["XREF-526F94D1B2AA","PATH-2BFCFED9D789","NODE-6580CFCA31B7","NODE-0E943B9CD896"],"factors":[{"applied_cap":null,"evidence_ids":["XREF-526F94D1B2AA","PATH-2BFCFED9D789","NODE-6580CFCA31B7","NODE-0E943B9CD896"],"explanation":"The source and target are distinct indexed concepts, and the resolvable target materially extends navigation.","factor_id":"cross_reference_validity","label":"Cross-reference validity","score":100.0,"severity_caps":[],"status":"supported"}],"grade":{"band":"excellent","color_token":"grade_excellent","rating":5.0,"score":100.0,"status":"passes"},"grade_scope":"one_cross_reference_relationship","item_id":"XREF-526F94D1B2AA","item_kind":"cross_reference","label":"see also assignats","navigation":{"source_node_id":"NODE-6580CFCA31B7","source_path_id":"PATH-2BFCFED9D789","target_path_id":null},"source_order":4,"summary":"The source and target are distinct indexed concepts, and the resolvable target materially extends navigation."},
    {"confidence":"high","detail":{"judgment":"supported","record_id":"REC-9F17445B8061","reference_type":"see also","source_node_id":"NODE-D5CA813D62EC","source_path_id":"PATH-C7CBB2DC117D","target_display":"Saint-Domingue","target_path_id":"PATH-F58FCB3D6EDA"},"evidence_ids":["XREF-5493E32901C0","PATH-C7CBB2DC117D","NODE-D5CA813D62EC","NODE-E3B234EAAE87"],"factors":[{"applied_cap":null,"evidence_ids":["XREF-5493E32901C0","PATH-C7CBB2DC117D","NODE-D5CA813D62EC","NODE-E3B234EAAE87"],"explanation":"The source and target are distinct indexed concepts, and the resolvable target materially extends navigation.","factor_id":"cross_reference_validity","label":"Cross-reference validity","score":100.0,"severity_caps":[],"status":"supported"}],"grade":{"band":"excellent","color_token":"grade_excellent","rating":5.0,"score":100.0,"status":"passes"},"grade_scope":"one_cross_reference_relationship","item_id":"XREF-5493E32901C0","item_kind":"cross_reference","label":"see also Saint-Domingue","navigation":{"source_node_id":"NODE-D5CA813D62EC","source_path_id":"PATH-C7CBB2DC117D","target_path_id":"PATH-F58FCB3D6EDA"},"source_order":5,"summary":"The source and target are distinct indexed concepts, and the resolvable target materially extends navigation."},
    {"confidence":"high","detail":{"judgment":"unsupported","record_id":"REC-5588C3D9F493","reference_type":"see also","source_node_id":"NODE-0D1729D88C85","source_path_id":"PATH-E561A4D4B454","target_display":"individual regiments","target_path_id":null},"evidence_ids":["XREF-6E6F54660707","PATH-E561A4D4B454","NODE-0D1729D88C85","DEFECT-50EF877CB81B"],"factors":[{"applied_cap":55.0,"evidence_ids":["XREF-6E6F54660707","PATH-E561A4D4B454","NODE-0D1729D88C85","DEFECT-50EF877CB81B"],"explanation":"The displayed target “individual regiments” is neither an indexed heading nor a deterministic list of resolvable targets, so the reference terminates without access.","factor_id":"cross_reference_validity","label":"Cross-reference validity","score":0.0,"severity_caps":[{"defect_id":"DEFECT-50EF877CB81B","maximum_score":55.0,"severity":"major","summary":"The displayed target “individual regiments” is neither an indexed heading nor a deterministic list of resolvable targets, so the reference terminates without access."}],"status":"unsupported"}],"grade":{"band":"poor","color_token":"grade_poor","rating":0.0,"score":0.0,"status":"fails"},"grade_scope":"one_cross_reference_relationship","item_id":"XREF-6E6F54660707","item_kind":"cross_reference","label":"see also individual regiments","navigation":{"source_node_id":"NODE-0D1729D88C85","source_path_id":"PATH-E561A4D4B454","target_path_id":null},"source_order":6,"summary":"The displayed target “individual regiments” is neither an indexed heading nor a deterministic list of resolvable targets, so the reference terminates without access."},